{"action":{"belt_slot":null,"candidate_id":1,"equipment_slot":null,"features":[1.0,0.0,0.0],"inventory_slot":null,"kind":"MOVE_TO_TILE","label":"Move to 2,1","spell_id":null,"stat_id":null,"store_item_id":null,"target_entity_id":null,"target_tile":{"x":2,"y":1}},"behavior":{"agent_name":"heuristic"},"episode_id":"mock-combat.single_melee.v0-7-0000","info":{"damage_dealt":0,"damage_taken":0,"events":["PLAYER_MOVED:2,1"],"newly_explored":5,"outcome":"ONGOING","reward_components":{"damage_dealt":0.0,"damage_taken":-0.0,"death":0.0,"living_cost":-0.001,"newly_explored":0.005,"picked_potion":0.0,"success":0.0}},"next_observation":{"decision_reason":"PLAYER_READY","engine_tick":1,"entities":[{"attributes":{},"entity_id":200,"hostile":false,"hp":null,"hp_max":null,"kind":"ITEM","position":{"x":2,"y":1},"type_id":"HEALING_POTION","visible":true}],"episode_id":"mock-combat.single_melee.v0-7-0000","legal_actions":[{"belt_slot":null,"candidate_id":0,"equipment_slot":null,"features":[-1.0,0.0,0.0],"inventory_slot":null,"kind":"MOVE_TO_TILE","label":"Move to 1,1","spell_id":null,"stat_id":null,"store_item_id":null,"target_entity_id":null,"target_tile":{"x":1,"y":1}},{"belt_slot":null,"candidate_id":1,"equipment_slot":null,"features":[0.0,1.0,0.0],"inventory_slot":null,"kind":"MOVE_TO_TILE","label":"Move to 2,2","spell_id":null,"stat_id":null,"store_item_id":null,"target_entity_id":null,"target_tile":{"x":2,"y":2}},{"belt_slot":null,"candidate_id":2,"equipment_slot":null,"features":[1.0,0.0,0.0],"inventory_slot":null,"kind":"MOVE_TO_TILE","label":"Move to 3,1","spell_id":null,"stat_id":null,"store_item_id":null,"target_entity_id":null,"target_tile":{"x":3,"y":1}},{"belt_slot":null,"candidate_id":3,"equipment_slot":null,"features":[0.0,0.0,1.0],"inventory_slot":null,"kind":"PICK_UP_ITEM","label":"Pick up potion","spell_id":null,"stat_id":null,"store_item_id":null,"target_entity_id":200,"target_tile":null},{"belt_slot":null,"candidate_id":4,"equipment_slot":null,"features":[],"inventory_slot":null,"kind":"WAIT","label":"Wait","spell_id":null,"stat_id":null,"store_item_id":null,"target_entity_id":null,"target_tile":null}],"local_tiles":[{"explored":true,"hazard":0.0,"occupied":false,"relative":{"x":-2,"y":-1},"terrain_id":0,"visible":true,"walkable":false},{"explored":true,"hazard":0.0,"occupied":false,"relative":{"x":-1,"y":-1},"terrain_id":0,"visible":true,"walkable":false},{"explored":true,"hazard":0.0,"occupied":false,"relative":{"x":0,"y":-1},"terrain_id":0,"visible":true,"walkable":false},{"explored":true,"hazard":0.0,"occupied":false,"relative":{"x":1,"y":-1},"terrain_id":0,"visible":true,"walkable":false},{"explored":true,"hazard":0.0,"occupied":false,"relative":{"x":2,"y":-1},"terrain_id":0,"visible":true,"walkable":false},{"explored":false,"hazard":0.0,"occupied":false,"relative":{"x":3,"y":-1},"terrain_id":-1,"visible":false,"walkable":false},{"explored":false,"hazard":0.0,"occupied":false,"relative":{"x":4,"y":-1},"terrain_id":-1,"visible":false,"walkable":false},{"explored":false,"hazard":0.0,"occupied":false,"relative":{"x":5,"y":-1},"terrain_id":-1,"visible":false,"walkable":false},{"explored":false,"hazard":0.0,"occupied":false,"relative":{"x":6,"y":-1},"terrain_id":-1,"visible":false,"walkable":false},{"explored":true,"hazard":0.0,"occupied":false,"relative":{"x":-2,"y":0},"terrain_id":0,"visible":true,"walkable":false},{"explored":true,"hazard":0.0,"occupied":false,"relative":{"x":-1,"y":0},"terrain_id":1,"visible":true,"walkable":true},{"explored":true,"hazard":0.0,"occupied":true,"relative":{"x":0,"y":0},"terrain_id":1,"visible":true,"walkable":true},{"explored":true,"hazard":0.0,"occupied":false,"relative":{"x":1,"y":0},"terrain_id":1,"visible":true,"walkable":true},{"explored":true,"hazard":0.0,"occupied":false,"relative":{"x":2,"y":0},"terrain_id":1,"visible":true,"walkable":true},{"explored":true,"hazard":0.0,"occupied":false,"relative":{"x":3,"y":0},"terrain_id":1,"visible":true,"walkable":true},{"explored":false,"hazard":0.0,"occupied":false,"relative":{"x":4,"y":0},"terrain_id":-1,"visible":false,"walkable":false},{"explored":false,"hazard":0.0,"occupied":false,"relative":{"x":5,"y":0},"terrain_id":-1,"visible":false,"walkable":false},{"explored":false,"hazard":0.0,"occupied":false,"relative":{"x":6,"y":0},"terrain_id":-1,"visible":false,"walkable":false},{"explored":true,"hazard":0.0,"occupied":false,"relative":{"x":-2,"y":1},"terrain_id":0,"visible":true,"walkable":false},{"explored":true,"hazard":0.0,"occupied":false,"relative":{"x":-1,"y":1},"terrain_id":1,"visible":true,"walkable":true},{"explored":true,"hazard":0.0,"occupied":false,"relative":{"x":0,"y":1},"terrain_id":1,"visible":true,"walkable":true},{"explored":true,"hazard":0.0,"occupied":false,"relative":{"x":1,"y":1},"terrain_id":1,"visible":true,"walkable":true},{"explored":true,"hazard":0.0,"occupied":false,"relative":{"x":2,"y":1},"terrain_id":1,"visible":true,"walkable":true},{"explored":false,"hazard":0.0,"occupied":false,"relative":{"x":3,"y":1},"terrain_id":-1,"visible":false,"walkable":false},{"explored":false,"hazard":0.0,"occupied":false,"relative":{"x":4,"y":1},"terrain_id":-1,"visible":false,"walkable":false},{"explored":false,"hazard":0.0,"occupied":false,"relative":{"x":5,"y":1},"terrain_id":-1,"visible":false,"walkable":false},{"explored":false,"hazard":0.0,"occupied":false,"relative":{"x":6,"y":1},"terrain_id":-1,"visible":false,"walkable":false},{"explored":true,"hazard":0.0,"occupied":false,"relative":{"x":-2,"y":2},"terrain_id":0,"visible":false,"walkable":false},{"explored":true,"hazard":0.0,"occupied":false,"relative":{"x":-1,"y":2},"terrain_id":1,"visible":true,"walkable":true},{"explored":true,"hazard":0.0,"occupied":false,"relative":{"x":0,"y":2},"terrain_id":1,"visible":true,"walkable":true},{"explored":true,"hazard":0.0,"occupied":false,"relative":{"x":1,"y":2},"terrain_id":1,"visible":true,"walkable":true},{"explored":false,"hazard":0.0,"occupied":false,"relative":{"x":2,"y":2},"terrain_id":-1,"visible":false,"walkable":false},{"explored":false,"hazard":0.0,"occupied":false,"relative":{"x":3,"y":2},"terrain_id":-1,"visible":false,"walkable":false},{"explored":false,"hazard":0.0,"occupied":false,"relative":{"x":4,"y":2},"terrain_id":-1,"visible":false,"walkable":false},{"explored":false,"hazard":0.0,"occupied":false,"relative":{"x":5,"y":2},"terrain_id":-1,"visible":false,"walkable":false},{"explored":false,"hazard":0.0,"occupied":false,"relative":{"x":6,"y":2},"terrain_id":-1,"visible":false,"walkable":false},{"explored":false,"hazard":0.0,"occupied":false,"relative":{"x":-2,"y":3},"terrain_id":-1,"visible":false,"walkable":false},{"explored":true,"hazard":0.0,"occupied":false,"relative":{"x":-1,"y":3},"terrain_id":1,"visible":false,"walkable":true},{"explored":true,"hazard":0.0,"occupied":false,"relative":{"x":0,"y":3},"terrain_id":1,"visible":true,"walkable":true},{"explored":false,"hazard":0.0,"occupied":false,"relative":{"x":1,"y":3},"terrain_id":-1,"visible":false,"walkable":false},{"explored":false,"hazard":0.0,"occupied":false,"relative":{"x":2,"y":3},"terrain_id":-1,"visible":false,"walkable":false},{"explored":false,"hazard":0.0,"occupied":false,"relative":{"x":3,"y":3},"terrain_id":-1,"visible":false,"walkable":false},{"explored":false,"hazard":0.0,"occupied":false,"relative":{"x":4,"y":3},"terrain_id":-1,"visible":false,"walkable":false},{"explored":false,"hazard":0.0,"occupied":false,"relative":{"x":5,"y":3},"terrain_id":-1,"visible":false,"walkable":false},{"explored":false,"hazard":0.0,"occupied":false,"relative":{"x":6,"y":3},"terrain_id":-1,"visible":false,"walkable":false},{"explored":false,"hazard":0.0,"occupied":false,"relative":{"x":-2,"y":4},"terrain_id":-1,"visible":false,"walkable":false},{"explored":false,"hazard":0.0,"occupied":false,"relative":{"x":-1,"y":4},"terrain_id":-1,"visible":false,"walkable":false},{"explored":false,"hazard":0.0,"occupied":false,"relative":{"x":0,"y":4},"terrain_id":-1,"visible":false,"walkable":false},{"explored":false,"hazard":0.0,"occupied":false,"relative":{"x":1,"y":4},"terrain_id":-1,"visible":false,"walkable":false},{"explored":false,"hazard":0.0,"occupied":false,"relative":{"x":2,"y":4},"terrain_id":-1,"visible":false,"walkable":false},{"explored":false,"hazard":0.0,"occupied":false,"relative":{"x":3,"y":4},"terrain_id":-1,"visible":false,"walkable":false},{"explored":false,"hazard":0.0,"occupied":false,"relative":{"x":4,"y":4},"terrain_id":-1,"visible":false,"walkable":false},{"explored":false,"hazard":0.0,"occupied":false,"relative":{"x":5,"y":4},"terrain_id":-1,"visible":false,"walkable":false},{"explored":false,"hazard":0.0,"occupied":false,"relative":{"x":6,"y":4},"terrain_id":-1,"visible":false,"walkable":false},{"explored":false,"hazard":0.0,"occupied":false,"relative":{"x":-2,"y":5},"terrain_id":-1,"visible":false,"walkable":false},{"explored":false,"hazard":0.0,"occupied":false,"relative":{"x":-1,"y":5},"terrain_id":-1,"visible":false,"walkable":false},{"explored":false,"hazard":0.0,"occupied":false,"relative":{"x":0,"y":5},"terrain_id":-1,"visible":false,"walkable":false},{"explored":false,"hazard":0.0,"occupied":false,"relative":{"x":1,"y":5},"terrain_id":-1,"visible":false,"walkable":false},{"explored":false,"hazard":0.0,"occupied":false,"relative":{"x":2,"y":5},"terrain_id":-1,"visible":false,"walkable":false},{"explored":false,"hazard":0.0,"occupied":false,"relative":{"x":3,"y":5},"terrain_id":-1,"visible":false,"walkable":false},{"explored":false,"hazard":0.0,"occupied":false,"relative":{"x":4,"y":5},"terrain_id":-1,"visible":false,"walkable":false},{"explored":false,"hazard":0.0,"occupied":false,"relative":{"x":5,"y":5},"terrain_id":-1,"visible":false,"walkable":false},{"explored":false,"hazard":0.0,"occupied":false,"relative":{"x":6,"y":5},"terrain_id":-1,"visible":false,"walkable":false},{"explored":false,"hazard":0.0,"occupied":false,"relative":{"x":-2,"y":6},"terrain_id":-1,"visible":false,"walkable":false},{"explored":false,"hazard